{"event_id":"11111111-1111-4111-8111-111111111113","event_type":"access.provision.succeeded.v1","schema_version":1,"occurred_at":"2026-07-18T12:00:05Z","producer":"provisioning-service","correlation_id":"22222222-2222-4222-8222-222222222222","causation_id":"11111111-1111-4111-8111-111111111111","aggregate_type":"credential","aggregate_id":"44444444-4444-4444-8444-444444444444","partition_key":"credential:44444444-4444-4444-8444-444444444444","data":{"operation_id":"55555555-5555-4555-8555-555555555555","credential_id":"44444444-4444-4444-8444-444444444444","applied_revision":1,"status":"active","endpoints":[{"node_id":"66666666-6666-4666-8666-666666666666","role":"primary","address":"vpn.example.invalid","port":443,"server_name":"cdn.example.invalid","reality_public_key":"AAAAAAAAAAAAAAAAAAAAAAAAAAAAAAAAAAAAAAAAAAA","short_id":"0011aabb","spider_x":"/","label":"VPN Primary"},{"node_id":"77777777-7777-4777-8777-777777777777","role":"failover","address":"backup.example.invalid","port":443,"server_name":"www.example.invalid","reality_public_key":"BBBBBBBBBBBBBBBBBBBBBBBBBBBBBBBBBBBBBBBBBBB","short_id":"2233ccdd","label":"VPN Failover"}],"applied_at":"2026-07-18T12:00:05Z"}}
